Company,Job Title,Required Skills,Experience,Qualification
Easy Recruit,Business Manager- National,"['business management', 'marketing', 'channel partners management', 'sales forecasting', 'branding', 'sales strategy', 'business growth', 'sales']",15-20 Yrs,"['Any Graduate', 'MBA/PGDM in Any Specialization', 'Doctorate Not Required']"
Ace Talent Consulting,Python / Networking Professional,"['Networking', 'Python', 'Async IO', 'HTTP', 'OOPs', 'REST', 'IT Skills', 'regex']",4-9 Yrs,"['Any Graduate', 'Any Postgraduate', 'Doctorate Not Required']"
TheRecruit (Brand of Consult Cubatic EPC Pvt Ltd,Technical Project Manager,"['IT Project Management', 'communication', 'resource planning', 'Agile Methodologies', 'product development', 'Scrum', 'Jira']",5-10 Yrs,"['BCA in Any Specialization, B.Tech/B.E. in Any Specialization', 'M.Tech in Any Specialization, MCA in Any Specialization', 'Doctorate Not Required']"
Ace Talent Consulting,Python + Networking professional,"['Python', 'HTTP', 'OOPs', 'development', 'REST 8', 'Async IO', 'IT Skills', 'REST API']",4-8 Yrs,"['B.Tech/B.E. in Any Specialization', 'Any Postgraduate', 'Doctorate Not Required']"
Keysite Solutions Executive Search,State Head - Sales - Consumer Durables,"['Sales', 'customer satisfaction', 'Channel Management', 'Network Trend Analysis', 'Network loss analysis']",10-15 Yrs,"['Any Graduate', 'Any Postgraduate', 'Doctorate Not Required']"
SKILLVENTORY,"Presales (B.Tech – Metallury), Iron & Steel, Jaipur","['Product Development', 'Sales', 'Major Activities']",2-7 Yrs,['B.Tech/B.E. in Metallurgy']
PERSOLKELLY INDIA PRIVATE LIMITED    ,Quality Manager,"['building materials', 'quality manager', 'pipes and plumbing industry', 'Quality Assurance']",10-18 Yrs,['B.Tech/B.E. in Any Specialization']
Inspiration Manpower Consultancy Pvt. Ltd.  ,Embedded Software Developer,"['AUTOSAR', 'Embedded C', 'automotive', 'multi core', 'Unit Testing', 'communication', 'Flexray', 'CAN']",6-10 Yrs,[]
Parvati Associates and Co. ,E-Commerce Manager,"['online marketing', 'marketing', 'Delhi', 'New Delhi', 'online sales', 'E-commerce', 'online business', 'pharma']",5-6 Yrs,['Any Graduate']
Ace Talent Consulting,Python + Networking Professional,"['Python', 'REST', 'HTTP', 'OOPs', 'Async IO', 'IT Skills', 'Product Development', 'Python Programming']",4-9 Yrs,"['Any Graduate', 'Any Postgraduate', 'Doctorate Not Required']"
Ace Talent Consulting,Python + Networking Professional,"['Python', 'development', 'Async IO', 'OOPs', 'REST 8', 'HTTP', 'IT Skills', 'REST']",4-8 Yrs,"['B.Tech/B.E. in Any Specialization', 'Any Postgraduate', 'Doctorate Not Required']"
Ace Talent Consulting,Python + Networking Professional,"['Python', 'OOPs', 'REST', 'Async IO', 'HTTP', 'IT Skills', 'Networking', 'product development']",4-9 Yrs,"['Any Graduate', 'Any Postgraduate', 'Doctorate Not Required']"
Keysite Solutions Executive Search,State Head - Sales,"['Sales', 'channel management', 'Business  planning', 'Sales Development', 'Product development', 'Business Development', 'Channel Management', 'sales support']",10-15 Yrs,"['Any Graduate', 'Any Postgraduate', 'Doctorate Not Required']"
Ace Talent Consulting,Python + Networking Professional,"['Python', 'HTTP', 'OOPs', 'development', 'REST 8', 'Async IO', 'IT Skills', 'REST']",4-8 Yrs,"['B.Tech/B.E. in Any Specialization', 'Any Postgraduate', 'Doctorate Not Required']"
Ace Talent Consulting,Python + Networking Professional,"['Python programming', 'Async IO', 'HTTP', 'Python', 'OOPs', 'REST', 'IT Skills', 'regex']",4-9 Yrs,"['Any Graduate', 'Any Postgraduate', 'Doctorate Not Required']"
OPTIONS INDIA GROUP,Manager - Operations - Food Manufacturing - NIT/IIT,"['Operations Management', 'Project Management', 'Mfg Operations', 'Supply chain system', 'Product development', 'Budgeting', 'Operations', 'FMCG Operations']",5-6 Yrs,"['B.Tech/B.E. in Any Specialization', 'Any Postgraduate', 'Doctorate Not Required']"
Stalwart Management Consulting,HRO Presales Role - BPO,"['Presales', 'SAP', 'product development', 'solution development', 'HRO Presales', 'Workday', 'Oracle HRMS', 'Human Resources operations']",12-18 Yrs,"['Any Graduate', 'Any Postgraduate', 'Doctorate Not Required']"
Resources Valley,Technical Lead Architect,"['.Net Core', 'technical leader', 'Azure', 'architect', 'Object Oriented Design', 'Node.js', 'Express.js', 'lead']",7-12 Yrs,"['Any Graduate', 'Any Postgraduate', 'Doctorate Not Required']"
Lakshya Software Technologies Private Limited ,DBA,"['cassandra', 'database administration', 'technical operations', 'nosql']",5-10 Yrs,['Any Graduate']
SKILLVENTORY,Hiring For NBFC :National Credit Manager : Business Loan : Pune,"['Training', 'Product Development', 'Credit Management', 'Business Loan', 'NBFC', 'Policy Framing', 'Underwriting', 'MIS']",8-13 Yrs,['MBA/PGDM in Any Specialization']
SKILLVENTORY,Hiring For NBFC :National Credit Manager : Business Loan : Pune,"['Training', 'Product Development', 'Credit Management', 'Business Loan', 'NBFC', 'Policy Framing', 'Underwriting', 'MIS']",8-13 Yrs,['MBA/PGDM in Any Specialization']
TAMCHERRY TECHNOLOGIES PRIVATE LIMITED,Senior Manager/AVP - Marketing,"['Avp', 'Senior Management', 'Marketing']",10-15 Yrs,['Other Graduate']
SKILLVENTORY,Asst Manager Plastic Interior & Exterior Systems,"['plastic', 'Quality Improvement', 'Exterior Systems', 'Seating', 'Continuous Improvement', 'Part Design', 'Cost Reduction', 'Trims Interior']",2-6 Yrs,[]
Intelli Search services private limited ,Head of UI UX,"['UX', 'User Experience', 'visual design', 'Figma', 'Photoshop', 'Illustrator', 'visual UI', 'Communication']",10-20 Yrs,['Any Graduate']
Lakshya Software Technologies Private Limited ,DBA,"['cassandra', 'database administration', 'technical operations', 'nosql']",5-10 Yrs,['Any Graduate']
Xpert Conexions   ,Asp.net with Leading Software MNC .,"['ASP.Net', 'Agile', 'CI / CD', 'Object - Oriented Principles', 'PLSQL', 'GIT', 'SVN', 'Web API']",2-7 Yrs,"['Any Graduate', 'Any Postgraduate', 'Any Doctorate']"
Acumen Enviro Solutions ,Microbiologist,"['Good Communication Skills', 'Technical Knowledge of EMS', 'Knowledge of Environment Audit']",2-3 Yrs,"['B.Sc in Microbiology, Chemistry', 'MS/M.Sc(Science) in Microbiology, Chemistry']"
Emmess technologies private Limited ,Python Developer,"['deep learning', 'python', 'tensorflow', 'data integration', 'Restful Web Api Development', 'PyTorch', 'communication', 'analytical']",1-3 Yrs,[]
Smart Source   ,Sr. Executive/Manager Sales-Top MNC-Bangalore,"['sales', 'B2B sales', 'Business Development', 'Corporate Sales']",4-9 Yrs,"['Any Graduate', 'CA in Any Specialization, ICWA (CMA) in Any Specialization, MBA/PGDM in Any Specialization']"
MAC Consultant ,E3D Modeller / Designer,['E3D'],3-8 Yrs,"['B.Tech/B.E. in Any Specialization, Any Graduate, Diploma in Any Specialization']"
REKRUT INDIA PRIVATE LIMITED   ,Merchant Acquisition Manager - POS / EDC,"['business development', 'Merchant Acquiring']",3-8 Yrs,['Any Graduate']
SKILLVENTORY,Vehicle Testing For a leading Automotive Green Energy Company,"['Emission Testing', 'On road Testing', 'Highway Testing', 'Homologation', 'certification']",5-10 Yrs,['B.Tech/B.E. in Any Specialization']
SKILLVENTORY,Data Privacy Specialist(Senior Manager),"['Senior Management', 'Data Privacy']",10-20 Yrs,"['Any Graduate', 'Any Postgraduate']"
Search Advisers Services ( GUJ ) Pvt. Ltd.  ,General Manager Talent Acquisition,"['Lateral Hiring', 'Leadership Hiring', 'Talent Acquisition', 'it hiring', 'Team Management', 'Executive Hiring', 'volume hiring', 'Engineering Recruitments']",10-16 Yrs,['MBA/PGDM in Any Specialization']
Search Advisers Services ( GUJ ) Pvt. Ltd.  ,General Manager Talent Acquisition,"['Lateral Hiring', 'Leadership Hiring', 'Talent Acquisition', 'it hiring', 'Team Management', 'Executive Hiring', 'volume hiring', 'Engineering Recruitments']",10-16 Yrs,['MBA/PGDM in Any Specialization']
Hiringlink Talent Solutions LLP ,Opening For Java developer - Work from Office,"['Java', 'Spring Boot', 'Tomcat', 'IntelliJ', 'GIT', 'Eclipse', 'Boot', 'Elasticsearch']",6-11 Yrs,['Any Graduate']
Orcapod Consulting Services Private Limited   ,Salesforce Developer,"['Sfdc Development', 'CSS', 'Javascript', 'Salesforce.com', 'Visualforce', 'IT Skills', 'HTML', 'Salesforce']",4-8 Yrs,['B.Tech/B.E. in Computers']
Talent  Corner HR Services Pvt Ltd,Embedded Developer,"['c++', 'Linux', 'Embedded', 'product development cycle', 'python', 'c', 'QT', 'Embedded Software Development']",3-5 Yrs,"['B.Tech/B.E. in Any Specialization, B.Sc in Computers']"
Squareroot Consulting Pvt Ltd.,Java Developer - Senior/Lead/Principal/Architect,"['OOA', 'Java', 'Hibernate', 'Platform', 'Scalable', 'OOPs', 'founder', 'Saas']",5-10 Yrs,"['Any Graduate', 'Any Postgraduate', 'Any Doctorate, Doctorate Not Required']"
Squareroot Consulting Pvt Ltd.,Data Architect,"['Java', 'Shell Scripting', 'Hadoop', 'Big Data', 'Data Mining', 'Perl', 'Distributed Systems', 'Microservices']",8-13 Yrs,"['B.Tech/B.E. in Computers', 'MCA in Computers, M.Tech in Computers', 'Ph.D/Doctorate in Computers']"
Yo HR Consultancy,Deputy Divisional Head - SMS Operations,"['SMS Operations', 'LRF', 'Ladle Refining furnace', 'EAF', 'Electric arc furnace', 'New Product development']",7-12 Yrs,"['Any Graduate', 'Any Postgraduate', 'Doctorate Not Required']"
Jeyam Consulting,Vice President / Director - Operations,"['Business development', 'Business Strategy', 'project management', 'Sales development', 'Business Operations']",15-25 Yrs,"['B.Tech/B.E. in Chemical', 'MBA/PGDM in Any Specialization', 'Doctorate Not Required']"
HR Ace,Solution Architect Growth,"['Market updates', 'Competitive products', 'Telecom service solutions', 'Delivery process', 'telecom', 'CCNA', 'CCNP']",10-12 Yrs,"['B.Tech/B.E. in Any Specialization', 'M.Tech in Any Specialization']"
Talent  Corner HR Services Pvt Ltd,R&D- Manager (Silvassa)- Lubricants,"['R&D', 'Formulation', 'Lubricants']",10-20 Yrs,"['B.Sc in Bio-Chemistry, Chemistry']"
SMART SOOURCE ,Cloud Software Developer ( Java / AWS/ Spring Boot / Microservices  ),"['spring boot', 'java', 'AWS', 'microservices', 'Cloud', 'kafka', 'scalability', 'Elastic Search']",5-10 Yrs,['B.Tech/B.E. in Any Specialization']
SMART SOOURCE ,Cloud Software Architect ( Java / AWS / Microservices / Spring Boot ),"['architectural design', 'java', 'Cloud', 'AWS', 'architecture', 'IT Skills', 'Software Development', 'Product Management']",15-24 Yrs,['B.Tech/B.E. in Any Specialization']
Squareroot Consulting Pvt Ltd.,Senior/ Java Developer,"['scalable', 'Java', 'Angularjs', 'Hibernate', 'J2Ee', 'Spring', 'Groovy', 'microservices']",3-6 Yrs,"['Any Graduate', 'Any Postgraduate', 'Any Doctorate']"
ShiningStars Institutions and Travels Pvt. Ltd. ,Assistant Quality Manager,"['quality management', 'quality control', 'bpo', 'auditing', 'internal audit']",2-6 Yrs,['Any Graduate']
SKILLVENTORY,Hiring For Bank : Market Head : BNPL : Mumbai,"['Social Media', 'Customer Segmentation', 'Web Technologies', 'Digital Campaigns', 'Digital Marketing', 'Digital Strategy', 'Facebook Marketing', 'SEO']",6-10 Yrs,['MBA/PGDM in Any Specialization']
SKILLVENTORY,Hiring For Bank : Market Head : BNPL(buy now pay later) : Mumbai,"['Social Media', 'Customer Segmentation', 'Web Technologies', 'Digital Campaigns', 'Digital Marketing', 'Digital Strategy', 'Facebook Marketing', 'SEO']",6-11 Yrs,['MBA/PGDM in Any Specialization']
Squareroot Consulting Pvt Ltd.,Java Architect/Senior Architect - Microservice/AWS,"['Java', 'Scalability', 'Web Technologies', 'SAAS', 'Web Application Development', 'Perl', 'Distributed Systems', 'Algorithm']",10-15 Yrs,"['Any Graduate', 'Any Postgraduate', 'Other Doctorate']"
Hikaho System Private limited,CAD Specialist,"['Design', 'AutoCAD', 'Creo', 'Product Development', 'Detailing', 'Plastic', 'Sheet Metal', 'New product development']",1-6 Yrs,"['B.Tech/B.E. in Mechanical, Diploma in Mechanical']"
Orcapod Consulting Services Private Limited,PTC Thingworx,['PTC Thingworx'],4-8 Yrs,"['Any Graduate', 'Any Postgraduate']"
Emmess technologies private Limited ,Android Developer,"['Android Application Development', 'mobile development', 'json', 'SDK', 'Rest API', 'IT Skills', 'Software Development', 'Testing']",1-3 Yrs,[]
LIVE CONNECTIONS ,Regulatory Affairs,"['Regulatory Affairs', 'Investigator Brochure', 'Protocol', 'Clinical Study Report']",3-8 Yrs,"['Any Graduate', 'Any Postgraduate']"
SAHANA INFORMATION ,Electrical induction motor designer,"['TEAM CENTRE', 'NAVISION', 'speed', 'ACAD', 'RMXprt', 'SAP', 'EMTP', 'Simuling']",5-10 Yrs,"['Diploma in Electrical, Electronics/Telecommunication, B.Tech/B.E. in Production/Industrial, Instrumentation, Electrical']"
JOBS EXPERT PRIVATE LIMITED  ,Fullstack Software Developer / Java / Struts / Angular,"['Fullstack Development', 'agile methodology', 'Java', 'Struts 2', 'angular', 'troubleshooting', 'Springboot', 'communication']",5-10 Yrs,['Any Graduate']
PIER HR SERVICES ,Microbiologoist,"['microbiologist', 'Analysis', 'microbiology', 'Innoculum', 'Innoculation']",3-6 Yrs,['Any Postgraduate']
Venus Associates ,Manager production @ MNC_Hosur,"['New Product Development', 'Supplier selection for capital goods', 'Machine Installation completion finalization', 'machining fixtures']",12-15 Yrs,"['Diploma in Mechanical, B.Tech/B.E. in Mechanical']"
JOB JUNCTION INDIA.COM  ,Chemistry,"['Chemistry', 'Bsc', 'Msc', 'chemist', 'Biotechnology', 'medical', 'Molecular Biology', 'Microbiology']",1-3 Yrs,"['B.Sc in Bio-Chemistry, Chemistry', 'MS/M.Sc(Science) in Bio-Chemistry, Chemistry']"
HR Ace,Pune | Solution Architect,"['Promotions', 'New Product Development', 'Cost Effective', 'Finance', 'Market Share', 'Service Sales', 'Region']",9-14 Yrs,"['B.Tech/B.E. in Any Specialization', 'M.Tech in Any Specialization']"
N tech IT solutions Pvt Ltd,SAP Functional PP Consultant,"['SAP QM', 'SAP WM', 'SAP', 'Process Industry', 'SAP- MES', 'Chemical', 'QM modules', 'SAP PP']",8-9 Yrs,['M.Tech in Any Specialization']
SKILLVENTORY,Deputy Manager - Consumer Insights For a Global Food Brand,"['media planning', 'market research', 'Quantitative', 'Qualitative', 'Consumer Insights']",4-7 Yrs,['MBA/PGDM in Any Specialization']
Capital Placement Services,"R & D Executive For Agrochemical Industry in Saykha,Gujarat.","['R & D Executive', 'PDR preparations', 'gujrat', 'agro chemical', 'workup chemical', 'Scifinder', 'bharuch', 'Green Field Projects']",5-10 Yrs,"['MS/M.Sc(Science) in Chemistry', 'Ph.D/Doctorate in Chemistry']"
Balaji Placement  ,AutoCAD Draughtsman For Manesar -Haryana,"['Draftsman Activities', 'AutoCAD 2D', '2D']",1-5 Yrs,['Graduation Not Required']
Skill Associates  ,Openings For Foundry Metallurgist in Manufacturing Company Gummidipond,"['New Product Development', 'Metallurgy', 'Sop Preparation', 'Audit Management', 'quality']",8-12 Yrs,['B.Tech/B.E. in Metallurgy']
Creative Engineering Consultants India Pvt Ltd ,Catia - Vehicle Intergration / Plastic Body Design - Bangalore -3 -6 y,"['CATIA', 'design engineer', 'Plastic', 'vehicle intergration', 'body design', 'Plastic Design']",3-8 Yrs,"['Diploma in Mechanical, B.Tech/B.E. in Automobile, Mechanical']"
E2E Consultants    ,Project Manager/R&D-Thane Mumbai.,"['R&D', 'Project Management', 'Cell Culture', 'Life Sciences', 'Biotechnology', 'SAP']",5-9 Yrs,"['MS/M.Sc(Science) in Biotechnology', 'Ph.D/Doctorate in Biotechnology']"
EDGE IN ASIA RECRUITMENT PRIVATE LIMITED  ,Branch Operations,"['Branch Operations', 'Reinsurance', 'Project Management', 'Insurance']",5-10 Yrs,"['Any Graduate', 'Any Postgraduate']"
NVS Consultants Pvt. Ltd. ,Assistant Manager Quality ( Auto Ancillary ) - Indore,"['Kaizen', '5S System', 'QC Engineering', 'Customer Handling', 'Quality Control', 'Quality Circle', 'New Product Development', 'PPM']",6-10 Yrs,['B.Tech/B.E. in Mechanical']
HR Capital Consulting   ,Junior Merchandiser- Garment Export,"['Garment Merchandising', 'Product Development', 'Embroidery', 'Apparel Merchandising', 'New Product Development', 'Apparel Industry', 'Garment Construction', 'Merchandising']",1-3 Yrs,"['B.Tech/B.E. in Textile, Any Graduate']"
Jobline Consultants India Pvt. Ltd.   ,Urgent Requirement || Big Four Firms || QA Testing,"['Java', 'Automation', 'Selenium', 'Rest Assured', 'Cucumber', 'IT Skills']",3-8 Yrs,['Any Graduate']
Mpowering HR Solutions  ,Customer Experience Head,"['Engagement Management', 'Customer Satisfaction', 'Customer Service Management', 'Delivery Leadership', 'Delivery Management', 'Escalation Management', 'Service Improvement', 'Customer Analysis']",12-16 Yrs,"['B.Tech/B.E. in Electronics/Telecommunication, Computers', 'M.Tech in Electronics/Telecommunication, Computers, MBA/PGDM in Advertising/Mass Communication, Information Technology, International Business, Marketing, Systems, Operations']"
Nalanda Corporate Services Private Limited ,AR&D,"['AR&D', 'API Manufacturing', 'API', 'Bulk Drugs']",1-3 Yrs,"['B.Sc in Chemistry', 'M.Pharma in Any Specialization, MS/M.Sc(Science) in Chemistry']"
GVMS Infotech Private Limited ,Delivery Manager(Digital/Ecommerce),"['Agile', 'Ecommerce', 'Scrum', 'Delivery Manager', 'IT Skills', 'Java', 'Python', 'PHP']",10-15 Yrs,['Any Graduate']
GNH Solutions,immediate openings For Java Developer Experience,"['Hibernate', 'java', 'Spring Mvc', 'j2ee', 'Spring', 'core Java', 'MVC', 'IT Skills']",1-3 Yrs,"['Diploma in Any Specialization, B.Sc in Any Specialization, B.Tech/B.E. in Any Specialization, Any Graduate, BCA in Computers', 'Any Postgraduate, M.Tech in Any Specialization, Post Graduation Not Required, MS/M.Sc(Science) in Any Specialization', 'Doctorate Not Required']"
Creative Solution India ,Mechanical  catia v5  solid edge  design profiles ( 1To 6 years),['catia solid edge design engineer'],1-6 Yrs,"['Diploma in Mechanical, B.Tech/B.E. in Mechanical']"
ANAGH MANAGEMENT SERVICES PRIVATE LIMITED ,Assistant Brand Manager,"['npd', 'New Product Development', 'brand management', 'marketing']",3-8 Yrs,['MBA/PGDM in Any Specialization']
People Resources    ,Technology Transfer Executive,"['Technology Transfer', 'Scale Up', 'Pilot Plant', 'RPD', 'Scaling', 'Tech Transfer', 'FPD']",2-6 Yrs,['B.Tech/B.E. in Chemical']
Matrix job Solutions  ,Software Developer,"['SQL programming', 'Oracle Forms & Reports', 'migration Oracle forms 11G and adding new functionalities']",3-6 Yrs,"['BCA in Any Specialization', 'MCA in Any Specialization']"
SHAVISH HR AND DIGITAL MARKETING PRIVATE LIMITED ,Embedded Developer,"['Embedded C', 'can', 'Embedded']",4-9 Yrs,"['B.Tech/B.E. in Any Specialization, Any Graduate']"
Prescription Pharma Support Private Limited  ,Assistant Manager - API R&D - Synthesis,"['API R&D', 'API Synthesis']",7-10 Yrs,"['B.Sc in Any Specialization', 'M.Pharma in Any Specialization, MS/M.Sc(Science) in Any Specialization']"
ACZ Global Private Limited,M&A Manager,"['Tableau', 'PowerBI', 'written', 'project management', 'verbal communication', 'analytical', 'financial analysis', 'IT Skills']",7-12 Yrs,"['CA in Any Specialization, M.Tech in Any Specialization, MBA/PGDM in Any Specialization, CS in Any Specialization, M.Com in Any Specialization']"
FUTURES AND CAREERS,"Job Opportunity For ""Phlebotomist ""","['venepunctures', 'blood sample', 'finger stick']",2-3 Yrs,['Other Graduate']
Sai Placement  ,ADL Head/ General Manager,"['Head', 'analytical', 'ADL', 'Method development', 'Team handling', 'GM', 'DGM', 'analysis']",12-22 Yrs,['Ph.D/Doctorate in Any Specialization']
Squareroot Consulting Pvt Ltd.,Database Architect - Cloud Infrastructure,"['Golang', 'Java', 'Open Source', 'Database Design', 'Distributed Systems', 'Algorithm', 'Cloud Infrastructure', 'DBA Support']",10-16 Yrs,"['B.Tech/B.E. in Computers', 'M.Tech in Computers', 'Ph.D/Doctorate in Computers']"
VHR PROFESSIONAL SERVICES PRIVATE LIMITED    ,Data Scientist,"['Data Scientist', 'Statistical Analysis', 'data visualization', 'R', 'phython', 'MySQL', 'Data Mining', 'CRM']",6-11 Yrs,['Any Graduate']
Zend Consulting Services ,Senior Marketing Manager - For a Large FMCG / Food / Cosmetics / Org!,"['Digital Marketing', 'Marketing', 'Brand Management', 'PR', 'Public Relations', 'Skin Care', 'Product Introduction', 'Social Media Marketing']",10-19 Yrs,['Any Graduate']
Apex  ,Manager Design - Rotary Equipment,"['DESIGN', 'ROTARY EQUIPMENT']",5-10 Yrs,"['B.Tech/B.E. in Mechanical, Metallurgy']"
HR Capital Consulting   ,Sampling Incharge,"['Sample Development', 'sampling process', 'woven', 'hifashion', 'Womens Wear']",7-12 Yrs,['Any Graduate']
AUM people operations Pvt Ltd  ,Manager Turnkey Solutions,['Turnkey Project Management'],15-20 Yrs,['B.Tech/B.E. in Any Specialization']
Zodiac  HR Consultants (I) Pvt Ltd.,Formulation Head,"['Opthalmic', 'Injectable', 'Liquids', 'Tablets', 'ANDA', 'ADL', 'Formulation Development', 'Semisolids']",17-25 Yrs,"['B.Pharma in Any Specialization', 'M.Pharma in Any Specialization']"
SKILLVENTORY,"Director - Motor Assembly, For a leading EV Brand","['Assembly Head', 'Motor Assembly Line', 'Electric', 'Motor Assembly', 'Grinding']",15-25 Yrs,['B.Tech/B.E. in Any Specialization']
IFANglobal India Pvt. Ltd. ,Executive Assistant Required (Female)- Gurgaon,"['personal assistance', 'data analysis', 'Personnel Administration', 'ms office tools', 'administration', 'time management', 'research analysis', 'Organizational Management']",2-6 Yrs,['Any Postgraduate']
ProGetters   ,Depository Executive,"['Depository', 'Depository Services', 'Banking Operations', 'Data Entry', 'Operations']",2-5 Yrs,['Any Graduate']
Talent Destination,Lead Data Scientist,"['Data Science', 'rest api', 'Python', 'Docker', 'Data Scientist', 'aws']",6-10 Yrs,['B.Tech/B.E. in Any Specialization']
JOBS EXPERT PRIVATE LIMITED  ,Java Full Stack Developer,"['Struts', 'React', 'Struts 2', 'Angular', 'Java', 'Spring boot', 'Java 8 or 8+', 'Spring']",6-10 Yrs,['Any Graduate']
CREATIVE ENTERPRISES ,South India DMC Senior Operation Manager,"['Hotel Contracting', 'Itinerary', 'Dmc', 'Operations', 'Costing', 'Product Design']",1-6 Yrs,['Graduation Not Required']
CONNECTORS ,Executive - R&D (Bakery Culinary),"['R&D', 'Fats', 'Edible oil']",2-7 Yrs,['B.Tech/B.E. in Any Specialization']
Search Square ,Assistant Manager / DM ( Female ) For Healthcare MNC in Delhi,"['HR Generalist Activities', 'HR Operations']",6-11 Yrs,"['Any Graduate', 'MBA/PGDM in HR/Industrial Relations']"
Bhartia Management Consultancy ,Procurement (Manager/Sr.Manager),"['purchase', 'vendor development', 'procurement', 'TCO', 'materials management', 'engineering', 'Heavy Engineering', 'Contract Negotiations']",10-20 Yrs,['B.Tech/B.E. in Any Specialization']
UPSInverter.com ,Pcb Designer,"['Altium Designer', 'Protel', 'symatic', 'Altium']",3-4 Yrs,['B.Tech/B.E. in Electronics/Telecommunication']
Squareroot Consulting Pvt Ltd.,SMTS/PMTS - Golang/Python/Java,"['Java', 'conflict resolution', 'fault tolerance', 'Concurrency', 'Distributed Systems', 'scalability', 'Python', 'highvolume']",3-8 Yrs,"['B.Tech/B.E. in Computers', 'M.Tech in Computers', 'Ph.D/Doctorate in Computers']"
Zenith Services  ,SQA Manager,"['QA', 'STLC', 'SDLC', 'Saas Product Development', 'Devops']",12-16 Yrs,['B.Tech/B.E. in Any Specialization']
Shanvi Staffing And Training Services ,Solution Architect- Bangalore,"['Java', 'System Manageability', 'Storage', 'Product development', 'Python', 'REST APIs']",15-22 Yrs,['Any Graduate']
Sai Placement  ,HEAD/GM - R&D (Chemical industry),"['Head', 'research', 'chemical', 'Development', 'GM', 'BMR', 'Process Improvement', 'technology transfer']",15-24 Yrs,['Ph.D/Doctorate in Any Specialization']
Pragmatic HR Consultants ,Senior Officer - R & D,"['R&D', 'Ceramics', 'Technology Transfer', 'coatings development', 'Refractory coatings', 'refractory testing', 'additives testing', 'Coating']",2-7 Yrs,"['B.Tech/B.E. in Ceramics', 'M.Tech in Ceramics']"
Stanford Jobz ,Urgent Jira Administrator in Navi Mumbai,"['Jira developer', 'Jira Administrator', 'JIRA', 'Atlassian']",1-3 Yrs,['Any Graduate']
BHAGAT HR SERVICES ,AGM/ Sr. Manager( Design /tendering) - Water & Sewage Treatment,"['Head Of Tender', 'Tender & Design Head', 'design detailing', 'design & costing of WTP & STP', 'Tendering', 'Tender Management', 'Underground drainage works', 'Tender Preparation']",15-20 Yrs,"['B.Tech/B.E. in Mechanical, Civil']"
SKILLVENTORY,Team Lead - PLM Solution Architect For a leading Manuf Brand,"['PLM', 'PLM Architect', 'NPD', 'New Product Development', 'Team Leading', 'Process Definition', 'Solution Architecture']",10-15 Yrs,"['B.Tech/B.E. in Any Specialization', 'M.Tech in Any Specialization, MCA in Any Specialization']"
Squareroot Consulting Pvt Ltd.,Full Stack Architect - React.js/Redux,"['Technical Architect', 'Java', 'AngularJS', 'Redux', 'Distributed Systems', 'Algorithm', 'Architect', 'Microservices Architecture']",8-13 Yrs,"['B.Tech/B.E. in Any Specialization', 'MCA in Any Specialization, M.Tech in Any Specialization', 'Ph.D/Doctorate in Computers']"
GLOBAL TALENT SOLUTIONS ,Merchandiser,"['Testing Process', 'Product Development', 'Costing', 'Textile', 'quilts', 'soft home', 'Production', 'Sample Development']",3-6 Yrs,['Any Graduate']
EXPONENT CONSULTING PRIVATE LIMITED,International Marketing Manager-Automobiles,"['International Marketing', 'PR', 'Overseas Marketing', 'Branding', 'Export Marketing']",9-12 Yrs,['Any Graduate']
VM PLACEMENT SOLUTIONS ,Asst. Manager/ Manager-Design (cutting Tools),"['Designing and 3D modelling  of milling cutters turning holder and boring tools', '2D and 3D design software knowledge  preferably AutoCAD and Inventor knowledge']",7-12 Yrs,"['B.Tech/B.E. in Mechanical, Diploma in Mechanical']"
Nishra Associates   ,Sr. Manager DRA ROW,"['Drug Regulatory Affairs', 'Dossier submission', 'CTD', 'ectd', 'DRA', 'Regulatory Affairs', 'Dossier Preparation', 'DRA ROW']",14-20 Yrs,"['B.Pharma in Any Specialization', 'M.Pharma in Any Specialization, MS/M.Sc(Science) in Any Specialization']"
